Sheet: Customer View
A1: Service | B1: StateRent: $/GB-mo | C1: StateRent: month | D1: StateRent: GB | E1: StateRent:$ | F1: Subsidy(GB) | G1: Category | H1: Verification | I1: NumNodes | J1: NetworkCapacity(GB) | K1: ConsensusTakeover | L1: Protocol | M1: C/D | N1: UtilityChain(s) | O1: Chaintype | P1: UtilityToken | Q1: Chain | R1: Governence Token | S1: Notes | T1: Friction to Eth | U1: Gaurentee Type | W1: Egrees: $/Gbmo | X1: Typical Disk | Y1: Archival Media | Z1: Retr Latency | AA1: Retr Speed | AB1: Censorship Resitance | AC1: Darkness (Subpoenable?) | AD1: URL | AE1: DevOps Complexity | AF1: Fixed Erasure | AG1: Proof Types | AH1: ASIC | AI1: GPU | AJ1: CPU
A2: Wesendit-business | B2: of:=[.E2]/([.D2]*[.C2]) -> 0.0015 | C2: 12 | D2: 5000 | E2: 90
A3: Swarm | B3: of:=[.E3]/([.D3]*[.C3]) -> 0.00164395 | C3: 1 | D3: 1 | E3: 0.00164395 | G3: libp2p, DHT | H3: CR-Vote | L3: Libp2p-extension | M3: decentralised | N3: Gnosis | P3: BZZ | Q3: Ethereum
A4: Storj | B4: of:=[.E4]/([.D4]*[.C4]) -> 0.004 | C4: 1 | D4: 1 | E4: 0.004 | M4: semi | P4: STORJ
A5: Dropbox | B5: of:=[.E5]/([.D5]*[.C5]) -> 0.005 | C5: 1 | D5: 2000 | E5: 10 | M5: centralised
A6: Wesendit-business | B6: of:=[.E6]/([.D6]*[.C6]) -> 0.00598 | C6: 1 | D6: 5000 | E6: 29.9
A7: Celestia-Superblobs | B7: of:=[.E7]/([.D7]*[.C7]) -> 0.00675 | C7: 1200 | D7: 0.1 | E7: 0.81
A8: Akord-tier1 | B8: of:=[.E8]/([.D8]*[.C8]) -> 0.0075 | C8: 1200 | D8: 1 | E8: 9
A9: Akord-tier2 | B9: of:=[.E9]/([.D9]*[.C9]) -> 0.0075 | C9: 1200 | D9: 1 | E9: 9
A10: Scaleway | B10: of:=[.E10]/([.D10]*[.C10]) -> 0.0153846153846154 | C10: 0.0013 | D10: 1 | E10: 0.00002 | F10: 25 | G10: IPFS Pinning | M10: centralised
A11: Amazon S3 | B11: of:=[.E11]/([.D11]*[.C11]) -> 0.023 | C11: 1 | D11: 1 | E11: 0.023
A12: Delta (SIA?) | B12: of:=[.E12]/([.D12]*[.C12]) -> 0.025 | C12: 1 | D12: 1 | E12: 0.025 | M12: unclear
A13: Filebase-pro | B13: of:=[.E13]/([.D13]*[.C13]) -> 0.025 | C13: 1 | D13: 4000 | E13: 100
A14: Akord-tier1 | B14: of:=[.E14]/([.D14]*[.C14]) -> 0.035 | C14: 1 | D14: 200 | E14: 7
A15: Arweave-Akord | B15: of:=[.E15]/([.D15]*[.C15]) -> 0.035 | C15: 1 | D15: 200 | E15: 7 | M15: decentralised | S15: Akord? | Y15: Blocks?
A16: Pinata | B16: of:=[.E16]/([.D16]*[.C16]) -> 0.04 | C16: 1 | D16: 500 | E16: 20 | G16: IPFS Pinning | M16: centralised
A17: Pinata-tier2 | B17: of:=[.E17]/([.D17]*[.C17]) -> 0.04 | C17: 1 | D17: 2500 | E17: 100
A18: Filecoin-web3.storage | B18: of:=[.E18]/([.D18]*[.C18]) -> 0.05 | C18: 1 | D18: 2000 | E18: 100 | H18: CR-PoReps | L18: Libp2p-extension | M18: decentralised | P18: FIL
A19: Celestia-blobs | B19: of:=[.E19]/([.D19]*[.C19]) -> 0.0609166666666667 | C19: 1200 | D19: 0.1 | E19: 7.31 | H19: AA | M19: decentralised
A20: Infura | B20: of:=[.E20]/([.D20]*[.C20]) -> 0.08 | C20: 1 | D20: 1 | E20: 0.08 | G20: IPFS Pinning | M20: centralised
A21: Akord-tier2 | B21: of:=[.E21]/([.D21]*[.C21]) -> 0.099 | C21: 1 | D21: 1000 | E21: 99
A22: Filecoin-web3.storage | B22: of:=[.E22]/([.D22]*[.C22]) -> 0.1 | C22: 1 | D22: 100 | E22: 10 | H22: CR-PoReps | L22: Libp2p-extension | M22: decentralised | P22: FIL
A23: Ethereum Blobs | B23: of:=[.E23]/([.D23]*[.C23]) ->  | C23: E | D23: 0.1 | E23: 20.56 | M23: decentralised
A24: Scaleway-view2 | B24: of:=[.E24]/([.D24]*[.C24]) -> 0.384615384615385 | C24: 0.0013 | D24: 2000 | E24: 1
A25: ICP | B25: of:=[.E25]/([.D25]*[.C25]) -> 0.445833333333333 | C25: 12 | D25: 1 | E25: 5.35 | M25: unclear | S25: WASM + StableMem
A26: Wesendit-basic | B26: of:=[.E26]/([.D26]*[.C26]) -> 0.98 | C26: 1 | D26: 5 | E26: 4.9 | M26: centralised
A27: Scaleway-view2 | B27: of:=[.E27]/([.D27]*[.C27]) -> 7.69230769230769 | C27: 0.0013 | D27: 100 | E27: 1
A28: Ethereum State | B28: of:=[.E28]/([.D28]*[.C28]) -> 15.5833333333333 | C28: 1200 | D28: 0.1 | E28: 1870 | K28: 0.51 | M28: decentralised
A29: Ethereum State | B29: of:=[.E29]/([.D29]*[.C29]) -> 1400 | C29: 1200 | D29: 1 | E29: 1680000 | K29: 0.51 | M29: decentralised
A30: Arweave-RAW | B30: of:=[.E30]/([.D30]*[.C30]) ->  | C30: 1 | M30: decentralised | S30: Akord? | Y30: Blocks?
A31: Avail | B31: of:=[.E31]/([.D31]*[.C31]) ->  | C31: 1 | M31: ? | S31: Elastic Blobspace
A32: Codex | B32: of:=[.E32]/([.D32]*[.C32]) ->  | C32: 1 | M32: decentralised
A33: Crust | B33: of:=[.E33]/([.D33]*[.C33]) ->  | C33: 1 | G33: IPFS Pinning | H33: Blockchain Accounting | I33: 1067 | J33: 471909 | M33: centralised
A34: Ethereum Blockspace | B34: of:=[.E34]/([.D34]*[.C34]) ->  | M34: decentralised
A35: EthStorage | B35: of:=[.E35]/([.D35]*[.C35]) ->  | C35: 1 | M35: decentralised
A36: EthStorage | B36: of:=[.E36]/([.D36]*[.C36]) ->  | C36: 1000 | M36: decentralised
A37: Filebase | B37: of:=[.E37]/([.D37]*[.C37]) ->  | C37: 1 | G37: IPFS Pinning | M37: centralised
A38: Filecoin-RAW | B38: of:=[.E38]/([.D38]*[.C38]) ->  | C38: 1 | H38: CR-PoReps | L38: Libp2p-extension | M38: decentralised | P38: FIL
A39: Home NAS (n,k) | B39: of:=[.E39]/([.D39]*[.C39]) ->  | C39: 1 | M39: private
A40: Home NAS (verbatim) | B40: of:=[.E40]/([.D40]*[.C40]) ->  | C40: 1 | M40: private
A41: Logos | B41: of:=[.E41]/([.D41]*[.C41]) ->  | C41: 1 | M41: decentralised
A42: Temporal | B42: of:=[.E42]/([.D42]*[.C42]) ->  | C42: 1 | G42: IPFS Pinning | M42: centralised
A43: Scaleway-object | B43: of:=[.E43]/([.D43]*[.C43]) -> 
A44: Scaleway-glacier | B44: of:=[.E44]/([.D44]*[.C44]) -> 
A45: Scaleway-block | B45: of:=[.E45]/([.D45]*[.C45]) -> 